{
  "skill": "create-story",
  "customer": "LottoBW",
  "identifier": "CRM-2561",
  "timestamp": "2026-03-09T00:00:00.000Z",
  "status": "success",
  "summary": "3 User Stories für SAP-Integration erstellt: CRM-3070 (Integration-Sandbox aufsetzen), CRM-3071 (Deployment-Pipeline erweitern), CRM-3072 (Datenversorgung + E2E-Test). Alle unter Epic CRM-2561, Komponente B2B.",
  "artifacts": [
    "implementation-design/CRM-3070/implementation-notes.md",
    "implementation-design/CRM-3071/implementation-notes.md",
    "implementation-design/CRM-3072/implementation-notes.md"
  ],
  "output": "Stories created:\n- CRM-3070: Integration-Sandbox aufsetzen (Refresh von Produktion) — https://kommit.atlassian.net/browse/CRM-3070\n- CRM-3071: Deployment-Pipeline um Integration-Sandbox erweitern — https://kommit.atlassian.net/browse/CRM-3071\n- CRM-3072: Datenversorgung Integration-Sandbox (Credentials + Testdaten) — https://kommit.atlassian.net/browse/CRM-3072\n\nAll stories linked to Epic CRM-2561 with component B2B.\nDependency chain: CRM-3070 → CRM-3071 → CRM-3072"
}
