{
  "skill": "project-update",
  "customer": "reemtsma",
  "identifier": "2026-09-17",
  "timestamp": "2026-09-17T14:56:38",
  "status": "success",
  "summary": "Project update one-pager for 17 September 2026 with 6 items (1 rejected, 1 in testing, 3 in development, 1 waiting for approval), no open questions.",
  "artifacts": [
    "meetings/project_update_2026-09-17.html"
  ],
  "output": "Items: AP2-1574 — Rejected; AP2-1583 — In testing; AP2-1584 — In development; AP2-1507 — Waiting for approval; AP2-1558 — In development; AP2-1559 — In development"
}