{
  "skill": "create-story",
  "customer": "reemtsma",
  "identifier": "AP2-1170",
  "timestamp": "2026-06-11T09:00:00Z",
  "status": "success",
  "summary": "1 combined user story created for JPS Boarding Pass feature under epic AP2-1170. Story text output in chat per user preference (not pushed to Jira). Implementation notes already exist at implementation-design/BoardingPass/.",
  "artifacts": [
    "implementation-design/BoardingPass/implementation-notes.md"
  ],
  "output": "Story: JPS Boarding Pass — Automatische Erstellung nach Registrierung. Scope: Account field, Campaign Mechanic M29, Named Credential, HTTPCalloutConfiguration__mdt, BoardingPassService (Queueable), registration endpoint modifications (standard + Enjoyable), WebDB sync extension, unit tests. 11 acceptance criteria. 4 open items (API key, marketing_opt_in mapping, Umbraco rendering, Remote Site Setting). Jira Cloud ID access was denied — story text provided in chat for manual creation."
}